{
  "$schema": "https://aos-data.org/schema/unit.schema.json",
  "id": "myaris-purifiers",
  "name": "Myari's Purifiers",
  "faction": "lumineth-realm-lords",
  "points": 0,
  "stats": {
    "move": "6\"",
    "health": 3,
    "save": "5+",
    "control": 1
  },
  "role": "other",
  "keywords": [
    "AELF",
    "ALARITH",
    "CHAMPION",
    "INFANTRY",
    "LEGENDS",
    "LUMINETH REALM-LORDS",
    "ORDER",
    "SCINARI",
    "UNIQUE",
    "VANARI"
  ],
  "baseSize": 4,
  "weapons": [
    {
      "name": "Auralan Bow",
      "type": "ranged",
      "attacks": 1,
      "hit": "3+",
      "wound": "4+",
      "rend": 0,
      "damage": 1,
      "range": "12\"",
      "abilities": [
        "Crit (Auto-wound)"
      ]
    },
    {
      "name": "Purifier Weapons",
      "type": "melee",
      "attacks": 1,
      "hit": "2+",
      "wound": "4+",
      "rend": 0,
      "damage": 1
    }
  ],
  "_meta": {
    "lastUpdated": "2026-01-06",
    "source": "BSData import"
  },
  "grandAlliance": "order",
  "regimentKeywords": [
    "AELF",
    "ALARITH",
    "CHAMPION",
    "LEGENDS",
    "LUMINETH REALM-LORDS",
    "SCINARI",
    "VANARI"
  ],
  "abilities": [
    {
      "name": "Myari Lightcaller",
      "type": "passive",
      "effect": "While this unit’s **Myari Lightcaller** is on the battlefield, it has **^^Wizard (1) and the **^^Scinari^^** keyword."
    },
    {
      "name": "Dazzling Light",
      "type": "spell",
      "effect": "Until the start of your next turn, subtract 1 from hit rolls for attacks made by enemy units that are contesting that objective.",
      "phase": "hero",
      "declare": "Pick an objective that you do not control that is within 18\" of and visible to this unit’s **Myari Lightcaller**, then make a casting roll of 2D6.",
      "castingValue": 6,
      "keywords": [
        "**^^SPELL^^**"
      ]
    }
  ]
}
