{
  "$schema": "https://aos-data.org/schema/unit.schema.json",
  "id": "spire-tyrants",
  "name": "Spire Tyrants",
  "faction": "slaves-to-darkness",
  "points": 110,
  "stats": {
    "move": "5\"",
    "health": 1,
    "save": "5+",
    "control": 1
  },
  "role": "other",
  "keywords": [
    "CHAMPION (1/9)",
    "CHAOS",
    "INFANTRY",
    "LEGENDS",
    "SLAVES TO DARKNESS",
    "UNDIVIDED"
  ],
  "baseSize": 8,
  "weapons": [
    {
      "name": "Gladiator Weapons",
      "type": "melee",
      "attacks": 1,
      "hit": "4+",
      "wound": "4+",
      "rend": 0,
      "damage": 1,
      "abilities": [
        "Anti-**^^Hero^^** (+1 Rend)"
      ]
    }
  ],
  "_meta": {
    "lastUpdated": "2026-01-06",
    "source": "BSData import"
  },
  "grandAlliance": "chaos",
  "regimentKeywords": [
    "CHAMPION (1/9)",
    "LEGENDS",
    "SLAVES TO DARKNESS",
    "UNDIVIDED"
  ],
  "abilities": [
    {
      "name": "Fight for Glory",
      "type": "passive",
      "effect": "The first time each turn that this unit is picked to use a **^^Fight^^** ability in the combat phase, if this unit is wholly within 12\" of any friendly **^^Slaves to Darkness Heroes^^**, add 1 to the Attacks characteristic of this unit’s melee weapons for the rest of the turn."
    }
  ]
}
