{
  "$schema": "https://aos-data.org/schema/unit.schema.json",
  "id": "tuskgor-chariots",
  "name": "Tuskgor Chariots",
  "faction": "beasts-of-chaos",
  "points": 0,
  "stats": {
    "move": "10\"",
    "health": 7,
    "save": "4+",
    "control": 2
  },
  "role": "other",
  "keywords": [
    "BEASTS OF CHAOS",
    "BRAYHERD",
    "CHAOS",
    "LEGENDS",
    "WAR MACHINE"
  ],
  "baseSize": 1,
  "weapons": [
    {
      "name": "Despoiler Weapons",
      "type": "melee",
      "attacks": 1,
      "hit": "4+",
      "wound": "4+",
      "rend": 0,
      "damage": 1,
      "abilities": [
        "Crit (2 Hits)"
      ]
    },
    {
      "name": "Tuskgors’ Iron-hard Tusks",
      "type": "melee",
      "attacks": 1,
      "hit": "5+",
      "wound": "4+",
      "rend": 0,
      "damage": 1,
      "abilities": [
        "Companion"
      ]
    }
  ],
  "_meta": {
    "lastUpdated": "2026-01-06",
    "source": "BSData import"
  },
  "grandAlliance": "chaos",
  "regimentKeywords": [
    "BEASTS OF CHAOS",
    "BRAYHERD",
    "LEGENDS"
  ],
  "abilities": [
    {
      "name": "Tuskgor Charge",
      "type": "passive",
      "effect": "Roll a D3. On a 2+, inflict an amount of mortal damage on the target equal to the roll.",
      "phase": "charge",
      "declare": "If this unit charged this phase, pick an enemy unit within 1\" of it to be the target."
    }
  ]
}
