{
  "$schema": "https://aos-data.org/schema/unit.schema.json",
  "id": "gutter-runners",
  "name": "Gutter Runners",
  "faction": "skaven",
  "points": 110,
  "stats": {
    "move": "7\"",
    "health": 1,
    "save": "6+",
    "control": 1
  },
  "role": "other",
  "keywords": [
    "CHAOS",
    "ESHIN",
    "INFANTRY",
    "LEGENDS",
    "SKAVEN"
  ],
  "baseSize": 5,
  "weapons": [
    {
      "name": "Poisoned Stars",
      "type": "ranged",
      "attacks": 1,
      "hit": "4+",
      "wound": "4+",
      "rend": 0,
      "damage": 1,
      "range": "12\"",
      "abilities": [
        "Crit (Auto-wound)"
      ]
    },
    {
      "name": "Punch Dagger and Blade",
      "type": "melee",
      "attacks": 1,
      "hit": "3+",
      "wound": "4+",
      "rend": 0,
      "damage": 1,
      "abilities": [
        "Crit (Mortal)"
      ]
    }
  ],
  "_meta": {
    "lastUpdated": "2026-01-06",
    "source": "BSData import"
  },
  "grandAlliance": "chaos",
  "regimentKeywords": [
    "ESHIN",
    "LEGENDS",
    "SKAVEN"
  ],
  "abilities": [
    {
      "name": "Deliver the Killing Strike",
      "type": "once-per-battle",
      "effect": "Add 3 to the Attacks characteristic of this unit’s **Punch Dagger and Blade** for the rest of the turn.",
      "phase": "combat",
      "color": "Red",
      "abilityCategory": "Offensive"
    },
    {
      "name": "Sneaky Infiltrators",
      "type": "passive",
      "effect": "While each model in this unit is within 1\" of any terrain features, this unit cannot be targeted by shooting attacks unless the attacking model is within 9\" of it.",
      "color": "Green",
      "abilityCategory": "Defensive"
    }
  ]
}
