{
  "$schema": "https://aos-data.org/schema/unit.schema.json",
  "id": "plague-monks",
  "name": "Plague Monks",
  "faction": "skaven",
  "points": 140,
  "stats": {
    "move": "6\"",
    "health": 1,
    "save": "6+",
    "control": 1
  },
  "role": "other",
  "keywords": [
    "CHAMPION",
    "CHAOS",
    "INFANTRY",
    "MUSICIAN (1/20)",
    "PESTILENS",
    "SKAVEN",
    "STANDARD BEARER (1/20)"
  ],
  "baseSize": 20,
  "weapons": [
    {
      "name": "Foetid Weapons",
      "type": "melee",
      "attacks": 1,
      "hit": "4+",
      "wound": "4+",
      "rend": 0,
      "damage": 1,
      "abilities": [
        "Crit (Auto-wound)"
      ]
    }
  ],
  "_meta": {
    "lastUpdated": "2026-01-06",
    "source": "BSData import"
  },
  "grandAlliance": "chaos",
  "regimentKeywords": [
    "CHAMPION",
    "MUSICIAN (1/20)",
    "PESTILENS",
    "SKAVEN",
    "STANDARD BEARER (1/20)"
  ],
  "abilities": [
    {
      "name": "Spreaders of Filth and Disease",
      "type": "passive",
      "effect": "Each time a model in this unit is slain by a combat attack and that model was in combat with the attacking unit, roll a dice. On a 6+, inflict 1 mortal damage on the attacking unit after the **^^Fight^^** ability has been resolved."
    }
  ]
}
