{
  "$schema": "https://aos-data.org/schema/unit.schema.json",
  "id": "black-coach",
  "name": "Black Coach",
  "faction": "nighthaunt",
  "points": 230,
  "stats": {
    "move": "10\"",
    "health": 12,
    "save": "5+",
    "control": 5
  },
  "role": "other",
  "keywords": [
    "DEATH",
    "FLY",
    "NIGHTHAUNT",
    "WAR MACHINE",
    "WARD (5+)"
  ],
  "baseSize": 1,
  "weapons": [
    {
      "name": "Soulreach Grasp",
      "type": "ranged",
      "attacks": 1,
      "hit": "4+",
      "wound": "4+",
      "rend": 0,
      "damage": 1,
      "range": "12\"",
      "abilities": [
        "Crit (Auto-wound)",
        "Shoot In Combat"
      ]
    },
    {
      "name": "Wraith's Spectral Weapons",
      "type": "melee",
      "attacks": 1,
      "hit": "3+",
      "wound": "4+",
      "rend": 0,
      "damage": 1,
      "abilities": [
        "Anti-**^^Infantry^^** (+1 Rend)",
        "Crit (Auto-wound)"
      ]
    },
    {
      "name": "Relic Bearers’ Claws and Ethereal Steeds’ Hooves",
      "type": "melee",
      "attacks": 1,
      "hit": "4+",
      "wound": "4+",
      "rend": 0,
      "damage": 1,
      "abilities": [
        "Crit (Auto-wound)",
        "Companion"
      ]
    }
  ],
  "_meta": {
    "lastUpdated": "2026-01-06",
    "source": "BSData import"
  },
  "grandAlliance": "death",
  "regimentKeywords": [
    "FLY",
    "NIGHTHAUNT",
    "WARD (5+)"
  ],
  "abilities": [
    {
      "name": "Runaway Coach",
      "type": "passive",
      "effect": "Roll a D3. On a 2+, inflict an amount of mortal damage equal on the target equal to the roll.",
      "phase": "charge",
      "declare": "If this unit charged this phase, pick an enemy unit within 1\" of it to be the target."
    },
    {
      "name": "Nimbus of Power",
      "type": "once-per-turn",
      "effect": "If this unit is not in combat, remove it from the battlefield and set it up again on the battlefield more than 9\" from all enemy units.",
      "phase": "movement",
      "keywords": [
        "**^^CORE^^**"
      ]
    },
    {
      "name": "Evocation of Death",
      "type": "passive",
      "effect": "Set up a replacement unit wholly within 12\" of this unit. The replacement unit can only be set up in combat with enemy units that are in combat with this unit.",
      "phase": "any",
      "declare": "If any damage points were allocated to an enemy unit by this unit's combat attacks this turn and that enemy unit was destroyed this turn, pick a friendly non-**^^Unique Nighthaunt Hero^^** that has been destroyed."
    }
  ]
}
